Member State,Organisation,Board Member,Status,Group
:at: Austria,Federation of Austrian Industries (IV),Tobias Sonnweber,Member,Employer
:at: Austria,Austrian Association for Public and Social Economy (VOWG),Josef Wirth,Alternate,Employer
:at: Austria,"Federal Ministry of Labour, Social Affairs, Health Care & Consumer Protection (BMSGP)",Harald Fugger,Member,Government
:at: Austria,"Federal Ministry of Labour, Social Affairs, Health Care & Consumer Protection (BMSGP)",Petra Pencs,Alternate,Government
:at: Austria,Austrian Trade Unions Federation (OGB),Dinah Djalinous-Glatz,Member,Trade Union
:at: Austria,Austrian Federal Chamber of Labour,Adi Buxbaum,Alternate,Trade Union
:be: Belgium,Federation of Enterprises in Belgium (FEB-VBO),Kris De Meester,Member,Employer
:be: Belgium,Organisation for the Self-Employed and SMEs (UNIZO),Phillipe Van Walleghem,Alternate,Employer
:be: Belgium,"Federal Public Service Employment, Labour & Social Dialogue",Yves Bolsee,Member,Government
:be: Belgium,"Federal Public Service Employment, Labour & Social Dialogue",Alain Piette,Alternate,Government
:be: Belgium,Confederation of Christian Trade Unions (ACV-CSC),Stijn Gryp,Member,Trade Union
:be: Belgium,General Federation of Belgian Labour (ABVV-FGTB),Caroline Verdoot,Alternate,Trade Union
:bg: Bulgaria,Bulgarian Industrial Association (BIA),Dimiter Brankov,Member,Employer
:bg: Bulgaria,Bulgarian Industrial Capital Association (BICA),Teodor Dechev,Alternate,Employer
:bg: Bulgaria,Ministry of Labour and Social Policy,Nenko Salchev,Member,Government
:bg: Bulgaria,Ministry of Labour & Social Policy,Teodora Todorova,Alternate,Government
:bg: Bulgaria,Confederation of Independent Trade Unions in Bulgaria (CITUB),Todor Kapitanov,Member,Trade Union
:bg: Bulgaria,Confederation of Labour Podkrepa,Vesselin Mitov,Alternate,Trade Union
:cy: Cyprus,Cyprus Employers and Industrialists Federation (OEB),Polyvios Polyviou,Member,Employer
:cy: Cyprus,Cyprus Employers and Industrialists Federation (OEB),Georges Hadjikallis,Alternate,Employer
:cy: Cyprus,"Ministry of Labour, Welfare and Social Insurance",Orestis Messios,Member,Government
:cy: Cyprus,"Ministry of Labour, Welfare and Social Insurance",Panayiotis Savva,Alternate,Government
:cy: Cyprus,Cyprus Workers Confederation (SEK),Panikos Argyrides,Member,Trade Union
:cy: Cyprus,Cyprus Workers Confederation (SEK),Evangelos Evangelou,Alternate,Trade Union
:cz: Czechia,Confederation of Industry of Czech Republic (SPCR),Vladimira Drbalova,Member,Employer
:cz: Czechia,Association of Small & Medium-sized Enterprises and Crafts of Czech Republic (AMSP CR),Pavla Brecková,Alternate,Employer
:cz: Czechia,Ministry of Labour and Social Affairs,Vlastimil Vána,Member,Government
:cz: Czechia,Ministry of Labour and Social Affairs,Ondřej Krýsl,Alternate,Government
:cz: Czechia,Czech-Moravian Confederation of Trade Unions (CMKOS),Jiří Vaňásek,Member,Trade Union
:cz: Czechia,Czech-Moravian Confederation of Trade Unions (CMKOS),Jana Maláčová,Alternate,Trade Union
:de: Germany,Employers & Business Association of Mobility & Transport Service Providers (AGV MOVE),Matthias Rohrmann,Member,Employer
:de: Germany,Employers Association of Insurance Companies (AGV),Sebastian Hopfner,Alternate,Employer
:de: Germany,Federal Ministry of Labour & Social Affairs (BMAS),Thomas Voigtländer,Member,Government
:de: Germany,Federal Ministry of Labour & Social Affairs (BMAS),Ina Hinzer,Alternate,Government
:de: Germany,German Trade Union Confederation (DGB),Tanja Bergrath,Member,Trade Union
:de: Germany,German Trade Union Confederation (DGB),Livia Hentschel,Alternate,Trade Union
:dk: Denmark,Confederation of Danish Employers (DA),Christiane Mißlbeck-Winberg,Member,Employer
:dk: Denmark,Confederation of Danish Employers (DA),Maja Kluger Dionigi,Alternate,Employer
:dk: Denmark,Ministry of Employment,Lærke Thorø Borch Sloth,Alternate,Government
:dk: Denmark,Danish Trade Union Confederation (FH),Maria Bjerre,Member,Trade Union
:dk: Denmark,Akademikerne,Käthe Munk Ryom,Alternate,Trade Union
:ee: Estonia,Estonian Employers Confederation,Kristi Sõber,Member,Employer
:ee: Estonia,Estonian Employers Federation,Raul Eamets,Alternate,Employer
:ee: Estonia,Ministry of Social Affairs,Marian Juurik,Member,Government
:ee: Estonia,Ministry of Social Affairs,Marion Pajumets,Alternate,Government
:ee: Estonia,Estonian Trade Union Confederation (EAKL),Jaan-Hendrik Toomel,Member,Trade Union
:ee: Estonia,Estonian Employees Union Confederation (TALO),Madis Iganõmm,Alternate,Trade Union
:es: Spain,Association of Self-Employed workers (ATA),Celia Ferrero Romero,Member,Employer
:es: Spain,Spanish Confederation of SMEs,Miguel Canales Gutiérrez,Alternate,Employer
:es: Spain,Ministry of Labour & Social Economy,Marina Griñón Montes,Member,Government
:es: Spain,Ministry of Labour & Social Economy,Gloria Ortega González,Alternate,Government
:es: Spain,General Union of Workers (UGT),Antonio Miguel Luna Pavón,Member,Trade Union
:es: Spain,Federation of Workers' Commissions (CCOO),Fernando Rocha Sanchez,Alternate,Trade Union
:fi: Finland,Confederation of Finnish Industries (EK),Katja Miettinen,Member,Employer
:fi: Finland,Confederation of Finnish Industries (EK),Suvi Lahti-Leeve,Alternate,Employer
:fi: Finland,Ministry of Economic Affairs & Employment,Antti Narhinen,Member,Government
:fi: Finland,Ministry of Economic Affairs & Employment,Maija Lyly-Yrjänäinen,Alternate,Government
:fi: Finland,Central Organisation of Finnish Trade Unions (SAK),Juha Antila,Member,Trade Union
:fi: Finland,Finnish Confederation of Professionals (STTK),Seppo Nevalainen,Alternate,Trade Union
:fr: France,Union of the Social and United Economy (UDES),Sebastien Darrigrand,Member,Employer
:fr: France,Movement of Enterprises of France (MEDEF),Anne Vauchez,Alternate,Employer
:fr: France,"Ministry of Labour, Full Employment & Integration",Nathalie Vaysse,Member,Government
:fr: France,"Ministry of Labour, Full Employment & Integration",Lucile Castex-Chauve,Alternate,Government
:fr: France,French Democratic Confederation of Labour (CFDT),Charles Parmentier,Member,Trade Union
:fr: France,General Confederation of Labour (FGTA-FO),Romain Lasserre,Alternate,Trade Union
:gr: Greece,Hellenic Federation of Enterprises (SEV),Christos Ioannou,Member,Employer
:gr: Greece,Hellenic Federation of Enterprises (SEV),Katerina Daskalaki,Alternate,Employer
:gr: Greece,Ministry of Labour & Social Affairs,Triantafyllia Totou,Member,Government
:gr: Greece,Ministry of Labour & Social Affairs,Georgios Gourzoulidis,Alternate,Government
:gr: Greece,General Confederation of Labour (GSEE),Ioannis Poupkos,Member,Trade Union
:gr: Greece,General Confederation of Labour (GSEE),Panagiotis Kordatos,Alternate,Trade Union
:hr: Croatia,Croation Employers' Association (HUP),Nuša Žunec,Member,Employer
:hr: Croatia,Croatian Employers' Association (HUP),Dario Ćorić,Alternate,Employer
:hr: Croatia,"Ministry of Labour, Pension System, Family & Social Policy",Iva Musić Orešković,Member,Government
:hr: Croatia,"Ministry of Labour, Pension System, Family & Social Policy",Inja Ogrizović Džamonja,Alternate,Government
:hr: Croatia,Independent Trade Unions of Croatia (NHS),Marija Hanzevacki,Member,Trade Union
:hr: Croatia,Union of Autonomous Trade Unions of Croatia (SSSH),Dijana Sobota,Alternate,Trade Union
:hu: Hungary,BusinessHungary (MGYOSZ),Adrienn Balint,Member,Employer
:hu: Hungary,BusinessHungary (MGYOSZ),Andrea Magyar,Alternate,Employer
:hu: Hungary,Ministry for Economic Development,Krisztina Pelei,Member,Government
:hu: Hungary,Ministry of the Interior,Vera Judit Ács,Alternate,Government
:hu: Hungary,Hungarian Trade Union Confederation (MSZSZ),Szabolcs Beőthy-Fehér,Member,Trade Union
:hu: Hungary,Forum for the Cooperation of Trade Unions (SZEF),Viktória Szűcs,Alternate,Trade Union
:ie: Ireland,Irish Business & Employers Confederation (IBEC),Maeve McElwee,Member,Employer
:ie: Ireland,Irish Business & Employers Confederation (IBEC),Pauline O'Hare,Alternate,Employer
:ie: Ireland,Department of Enterprise Trade & Employment,Marcus Breathnach,Member,Government
:ie: Ireland,Department of Employment Affairs & Social Protection,Olivia Clarke,Alternate,Government
:ie: Ireland,Irish Congress of Trade Unions (ICTU),David Joyce,Member,Trade Union
:ie: Ireland,Irish Congress of Trade Unions (ICTU),Ger Gibbons,Alternate,Trade Union
:it: Italy,Confindustria,Stefania Rossi,Member,Employer
:it: Italy,Confindustria,Giovanni Morleo,Alternate,Employer
:it: Italy,Ministry of Labour & Social Policies,Romolo De Camillis,Member,Government
:it: Italy,Ministry of Labour & Social Partners,Rosanna Margiotta,Alternate,Government
:it: Italy,Italian General Federation of Labour (CGIL),Salvatore Marra,Member,Trade Union
:it: Italy,Italian Labour Union (UIL),Rossella Benedetti,Alternate,Trade Union
:lt: Lithuania,Lithuanian Business Confederation,Ineta Rizgelé,Member,Employer
:lt: Lithuania,Lithuanian Investors Forum,Monika Gabalyté,Alternate,Employer
:lt: Lithuania,Ministry of Social Security & Labour,Donata Šlekytė,Member,Government
:lt: Lithuania,Ministry of Social Security & Labour,Rita Skrebiškienė,Alternate,Government
:lt: Lithuania,Lithuanian Trade Union Solidarumas (LPSS),Daiva Kvedaraitė,Member,Trade Union
:lt: Lithuania,Lithuanian Trade Union Confederation (LPSK),Sigita Mykolaityté,Alternate,Trade Union
:lu: Luxembourg,FEDIL - The voicve of Luxembourg Industry,Philippe Heck,Member,Employer
:lu: Luxembourg,Fedil - The voice of Luxembourg's Industry,Marc Kieffer,Alternate,Employer
:lu: Luxembourg,"Ministry of Labour, Employment & the Social and Solidarity Economy",Tom Oswald,Member,Government
:lu: Luxembourg,"Ministry of Labour, Employment & the Social and Solidarity Economy",Bob Greis,Alternate,Government
:lu: Luxembourg,Luxembourg Independent Trade Union Confederation (OGB-L),Veronique Eischen,Member,Trade Union
:lu: Luxembourg,Confederation of Christian Trade Unions Luxembourg (LCGB),Patrick Dury,Alternate,Trade Union
:lv: Latvia,Employers Confederation of Latvia,Ilona Kiukucane,Member,Employer
:lv: Latvia,Employers Confederation of Latvia,Inese Stepina,Alternate,Employer
:lv: Latvia,Ministry of Welfare,Ineta Tare,Member,Government
:lv: Latvia,Ministry of Welfare,Ineta Vjakse,Alternate,Government
:lv: Latvia,Free Trade Union Confederation of Latvia (LBAS),Linda Romele,Member,Trade Union
:lv: Latvia,Free Trade Union Confederation of Latvia (LBAS),Mārtiņš Svirskis,Alternate,Trade Union
:mt: Malta,Malta Employers Association,Joe Farrugia,Member,Employer
:mt: Malta,"Malta Chamber of Commerce, Enterprise & Industry",Kevin Mizzi,Alternate,Employer
:mt: Malta,Department for Industrial & Employment Relations,Diane Vella Muscat,Member,Government
:mt: Malta,Department for Industrial & Employment Relations (DIER),Christopher Galea,Alternate,Government
:mt: Malta,General Workers Union (GWU),Josef Bugeja,Member,Trade Union
:mt: Malta,Malta Union of Midwives and Nurses (MUMN),Paul Pace,Alternate,Trade Union
:nl: Netherlands,Confederation of Netherlands Industry & Employers (VNO-NCW),Mario van Mierlo,Member,Employer
:nl: Netherlands,Association of Netherlands Municipalities (VNG),Nurcan Yilmaz,Alternate,Employer
:nl: Netherlands,Ministry of Social Affairs & Employment,Wilm Geurts,Member,Government
:nl: Netherlands,Ministry of Social Affairs & Employment,Alexandra Nicolai,Alternate,Government
:nl: Netherlands,Federation of Dutch Trade Unions (FNV),Jan Kouwenberg,Member,Trade Union
:nl: Netherlands,Christian National Trade Union Federation (CNV),Lottie van Kelle,Alternate,Trade Union
:pl: Poland,Polish Confederation Lewiatan,Andrzej Rudka,Member,Employer
:pl: Poland,Employers of Poland,Katarzyna Siemienkiewicz,Alternate,Employer
:pl: Poland,Ministry of Family & Social Policy,Jerzy Ciechański,Member,Government
:pl: Poland,Ministry of Family & Social Policy,Magdalena Zawadzka,Alternate,Government
:pl: Poland,Independent and Self-Governing Trade Union Solidarity (NSZZ Solidarnosc),Katarzyna Bartkiewicz,Member,Trade Union
:pl: Poland,All-Poland Alliance of Trade Unions (OPZZ),Katarzyna Pietrzak,Alternate,Trade Union
:pt: Portugal,Confederation of Trade and Services of Portugal (CCP),Manuel Marcelino Pena Costa,Member,Employer
:pt: Portugal,Confederation of Portuguese Industry (CIP),Luís Henrique,Alternate,Employer
:pt: Portugal,"Ministry of Labour, Solidarity & Social Security",Cristina Rodrigues,Member,Government
:pt: Portugal,"Ministry of Labour, Solidarity & Social Security",Ricardo Bernardes,Alternate,Government
:pt: Portugal,General Workers Union (UGT),Vanda Teresa Rogado Madeira,Member,Trade Union
:pt: Portugal,General Confederation of Portuguese Workers (CGTP),Hugo Filipe Rodrigues Dionísio,Alternate,Trade Union
:ro: Romania,Concordia Employers Confederation,Adelina Dabu,Member,Employer
:ro: Romania,Concordia Employers Confederation,Radu Burnete,Alternate,Employer
:ro: Romania,"Directorate of Employment Policies, Skills & Professional Mobility",Bianca Diana Mihăiță,Member,Government
:ro: Romania,"Ministry of Labour, Family, Social Protection & Elderly",Ioana Dumitrescu,Alternate,Government
:ro: Romania,Democratic Trade Union Confederation (CSDR),Sabin Rusu,Member,Trade Union
:ro: Romania,National Trade Union Confederation - Cartel ALFA,Mihaela Dârle,Alternate,Trade Union
:se: Sweden,Confederation of Swedish Enterprise,Patrik Karlsson,Member,Employer
:se: Sweden,Confederation of Swedish Enterprise,Anna Bergsten,Alternate,Employer
:se: Sweden,Ministry of Employment,Aurora Lewén,Member,Government
:se: Sweden,Ministry of Health & Social Affairs,Håkan Nyman,Alternate,Government
:se: Sweden,Swedish Confederation for Professional Employees (TCO),Hakan Gustavsson,Member,Trade Union
:se: Sweden,Swedish Trade Union Confederation (LO-S),Carola Löfstrand,Alternate,Trade Union
:si: Slovenia,Association of Employers  of Slovenia (ZDS),Miroslav Smrekar,Member,Employer
:si: Slovenia,Association of Employers in Craft & Small Business of Slovenia (ZDOPS),Nataša Cvetek,Alternate,Employer
:si: Slovenia,"Ministry of Labour, Family, Social Affairs & Equal Opportunities",Vladka Komel,Member,Government
:si: Slovenia,"Ministry of Labour, Family, Social Affairs & Equal Opportunities",Andraz Bobovnik,Alternate,Government
:si: Slovenia,Association of Free Trade Unions of Slovenia (ZSSS),Maja Konjar,Member,Trade Union
:si: Slovenia,Association of Free Trade Unions of Slovenia (ZSSS),Matija Drmota,Alternate,Trade Union
:sk: Slovakia,National Union of Employers (RUZ),Alexandra Šarinová,Member,Employer
:sk: Slovakia,National Union of Employers (RUZ),Katarína Marenčák,Alternate,Employer
:sk: Slovakia,"Ministry of Labour, Social Affairs & Family",Silvia Gregorcová,Member,Government
:sk: Slovakia,"Ministry of Labour, Social Affairs & Family",Ján Gabura,Alternate,Government
:sk: Slovakia,Confederation of Trade Unions of the Slovak Republic (KOZ),Miroslav Hajnoš,Member,Trade Union
N/A,Confederation of Norwegian Enterprise (NHO),Torstein Ulserød,EEA EFTA Observer,Employer
N/A,BusinessEurope,Anna Kwiatkiewicz,Coordinator,Employer
N/A,"DG Employment, Social Affairs & Inclusion",Barbara Kauffmann,Member,European Commission
N/A,DG Research & Innovation,Harald Hartung,Member,European Commission
N/A,DG Health and Food Safety,Veronique Wasbauer,Member,European Commission
N/A,"DG Employment, Social Affairs & Inclusion",Imad Kanjou Auge,Alternate,European Commission
N/A,DG Research & Innovation,Maria del Pilar Gonzalez Pantaleon,Alternate,European Commission
N/A,DG Health & Food Safety,Stefan Schreck,Alternate,European Commission
N/A,Ministry of Labour & Social Affairs (Norway),Anna Skarberg,EEA EFTA Observer,Government
N/A,Ministry of Labour & Social Affairs (Norway),Kristin Stanwick Bårnås,EEA EFTA Observer,Government
N/A,European Parliament,Veronica Lope Fontagné,Member,European Parliament
N/A,Norwegian Confederation of Trade Unions (NO),Liv Sannes,EEA EFTA Observer,Trade Union
N/A,European Trade Union Institute (ETUI),Aline Hoffmann,Deputy Coordinator,Trade Union
N/A,European Trade Union Confederation (ETUC),Tea Jarc,Coordinator,Trade Union
