,calc_subMinorCategory,calc_category_githubURL,calc_minorCategory,__KP_ID,Category
10,Direct subsidies (full or partial),https://static.eurofound.europa.eu/covid19db/categories/Supporting_businesses_to_stay_afloat.html,Supporting businesses to stay afloat,185,"<a href=""https://static.eurofound.europa.eu/covid19db/categories/Supporting_businesses_to_stay_afloat.html?utm_medium=datawrapper&utm_campaign=covid-19&utm_source=categoryOverview"">Supporting businesses to stay afloat</a>"
0,Access to finance,https://static.eurofound.europa.eu/covid19db/categories/Supporting_businesses_to_stay_afloat.html,Supporting businesses to stay afloat,103,"<a href=""https://static.eurofound.europa.eu/covid19db/categories/Supporting_businesses_to_stay_afloat.html?utm_medium=datawrapper&utm_campaign=covid-19&utm_source=categoryOverview"">Supporting businesses to stay afloat</a>"
14,Income support for people in employment (e.g. short-time work),https://static.eurofound.europa.eu/covid19db/categories/Employment_protection_and_retention.html,Employment protection and retention,99,"<a href=""https://static.eurofound.europa.eu/covid19db/categories/Employment_protection_and_retention.html?utm_medium=datawrapper&utm_campaign=covid-19&utm_source=categoryOverview"">Employment protection and retention</a>"
9,Deferral of payments or liabilities,https://static.eurofound.europa.eu/covid19db/categories/Supporting_businesses_to_stay_afloat.html,Supporting businesses to stay afloat,70,"<a href=""https://static.eurofound.europa.eu/covid19db/categories/Supporting_businesses_to_stay_afloat.html?utm_medium=datawrapper&utm_campaign=covid-19&utm_source=categoryOverview"">Supporting businesses to stay afloat</a>"
20,Occupational health and safety,https://static.eurofound.europa.eu/covid19db/categories/Protection_of_workers_adaption_of_workplace.html,"Protection of workers, adaptation of workplace",70,"<a href=""https://static.eurofound.europa.eu/covid19db/categories/Protection_of_workers_adaption_of_workplace.html?utm_medium=datawrapper&utm_campaign=covid-19&utm_source=categoryOverview"">Protection of workers, adaptation of workplace</a>"
2,"Active labour market policies, incl. subsidised job creation",https://static.eurofound.europa.eu/covid19db/categories/Promoting_the_economic_labour_market_and_social_recovery.html,"Promoting the economic, labour market and social recovery",65,"<a href=""https://static.eurofound.europa.eu/covid19db/categories/Promoting_the_economic_labour_market_and_social_recovery.html?utm_medium=datawrapper&utm_campaign=covid-19&utm_source=categoryOverview"">Promoting the economic, labour market and social recovery</a>"
38,"Teleworking arrangements, remote working",https://static.eurofound.europa.eu/covid19db/categories/Protection_of_workers_adaption_of_workplace.html,"Protection of workers, adaptation of workplace",60,"<a href=""https://static.eurofound.europa.eu/covid19db/categories/Protection_of_workers_adaption_of_workplace.html?utm_medium=datawrapper&utm_campaign=covid-19&utm_source=categoryOverview"">Protection of workers, adaptation of workplace</a>"
3,Change of production/innovation,https://static.eurofound.europa.eu/covid19db/categories/Re-orientation_of_business_activities.html,Reorientation of business activities,58,"<a href=""https://static.eurofound.europa.eu/covid19db/categories/Re-orientation_of_business_activities.html?utm_medium=datawrapper&utm_campaign=covid-19&utm_source=categoryOverview"">Reorientation of business activities</a>"
12,Extensions of  income support to workers not covered by any kind of protection scheme,https://static.eurofound.europa.eu/covid19db/categories/Income_protection_beyond_short-time_work.html,Income protection beyond short-time work,58,"<a href=""https://static.eurofound.europa.eu/covid19db/categories/Income_protection_beyond_short-time_work.html?utm_medium=datawrapper&utm_campaign=covid-19&utm_source=categoryOverview"">Income protection beyond short-time work</a>"
31,Protection of vulnerable groups (beyond employment support),https://static.eurofound.europa.eu/covid19db/categories/Measures_to_prevent_social_hardship.html,Measures to prevent social hardship,42,"<a href=""https://static.eurofound.europa.eu/covid19db/categories/Measures_to_prevent_social_hardship.html?utm_medium=datawrapper&utm_campaign=covid-19&utm_source=categoryOverview"">Measures to prevent social hardship</a>"
4,"Change of work arrangements (working time, rota schemes)",https://static.eurofound.europa.eu/covid19db/categories/Support_for_essential_services.html,Ensuring business continuity and support for essential services,35,"<a href=""https://static.eurofound.europa.eu/covid19db/categories/Support_for_essential_services.html?utm_medium=datawrapper&utm_campaign=covid-19&utm_source=categoryOverview"">Ensuring business continuity and support for essential services</a>"
33,Remuneration and rewards for workers in essential services,https://static.eurofound.europa.eu/covid19db/categories/Support_for_essential_services.html,Ensuring business continuity and support for essential services,35,"<a href=""https://static.eurofound.europa.eu/covid19db/categories/Support_for_essential_services.html?utm_medium=datawrapper&utm_campaign=covid-19&utm_source=categoryOverview"">Ensuring business continuity and support for essential services</a>"
36,Support for parents and carers (financial or in kind),https://static.eurofound.europa.eu/covid19db/categories/Income_protection_beyond_short-time_work.html,Income protection beyond short-time work,35,"<a href=""https://static.eurofound.europa.eu/covid19db/categories/Income_protection_beyond_short-time_work.html?utm_medium=datawrapper&utm_campaign=covid-19&utm_source=categoryOverview"">Income protection beyond short-time work</a>"
37,"Support for spending, stimulus packages",https://static.eurofound.europa.eu/covid19db/categories/Promoting_the_economic_labour_market_and_social_recovery.html,"Promoting the economic, labour market and social recovery",34,"<a href=""https://static.eurofound.europa.eu/covid19db/categories/Promoting_the_economic_labour_market_and_social_recovery.html?utm_medium=datawrapper&utm_campaign=covid-19&utm_source=categoryOverview"">Promoting the economic, labour market and social recovery</a>"
29,Paid sick leave,https://static.eurofound.europa.eu/covid19db/categories/Income_protection_beyond_short-time_work.html,Income protection beyond short-time work,30,"<a href=""https://static.eurofound.europa.eu/covid19db/categories/Income_protection_beyond_short-time_work.html?utm_medium=datawrapper&utm_campaign=covid-19&utm_source=categoryOverview"">Income protection beyond short-time work</a>"
41,Well-being of workers,https://static.eurofound.europa.eu/covid19db/categories/Protection_of_workers_adaption_of_workplace.html,"Protection of workers, adaptation of workplace",27,"<a href=""https://static.eurofound.europa.eu/covid19db/categories/Protection_of_workers_adaption_of_workplace.html?utm_medium=datawrapper&utm_campaign=covid-19&utm_source=categoryOverview"">Protection of workers, adaptation of workplace</a>"
15,Income support for unemployed,https://static.eurofound.europa.eu/covid19db/categories/Income_protection_beyond_short-time_work.html,Income protection beyond short-time work,26,"<a href=""https://static.eurofound.europa.eu/covid19db/categories/Income_protection_beyond_short-time_work.html?utm_medium=datawrapper&utm_campaign=covid-19&utm_source=categoryOverview"">Income protection beyond short-time work</a>"
16,Keeping a safe home,https://static.eurofound.europa.eu/covid19db/categories/Measures_to_prevent_social_hardship.html,Measures to prevent social hardship,26,"<a href=""https://static.eurofound.europa.eu/covid19db/categories/Measures_to_prevent_social_hardship.html?utm_medium=datawrapper&utm_campaign=covid-19&utm_source=categoryOverview"">Measures to prevent social hardship</a>"
19,Mobilisation of a larger workforce,https://static.eurofound.europa.eu/covid19db/categories/Support_for_essential_services.html,Ensuring business continuity and support for essential services,21,"<a href=""https://static.eurofound.europa.eu/covid19db/categories/Support_for_essential_services.html?utm_medium=datawrapper&utm_campaign=covid-19&utm_source=categoryOverview"">Ensuring business continuity and support for essential services</a>"
11,Enhancing employability and training,https://static.eurofound.europa.eu/covid19db/categories/Supporting_businesses_to_get_back-to-normal.html,Supporting businesses to get back to normal,21,"<a href=""https://static.eurofound.europa.eu/covid19db/categories/Supporting_businesses_to_get_back-to-normal.html?utm_medium=datawrapper&utm_campaign=covid-19&utm_source=categoryOverview"">Supporting businesses to get back to normal</a>"
23,Other,https://static.eurofound.europa.eu/covid19db/categories/Promoting_the_economic_labour_market_and_social_recovery.html,"Promoting the economic, labour market and social recovery",20,"<a href=""https://static.eurofound.europa.eu/covid19db/categories/Promoting_the_economic_labour_market_and_social_recovery.html?utm_medium=datawrapper&utm_campaign=covid-19&utm_source=categoryOverview"">Promoting the economic, labour market and social recovery</a>"
18,Measures to support a gradual relaunch of work,https://static.eurofound.europa.eu/covid19db/categories/Supporting_businesses_to_get_back-to-normal.html,Supporting businesses to get back to normal,19,"<a href=""https://static.eurofound.europa.eu/covid19db/categories/Supporting_businesses_to_get_back-to-normal.html?utm_medium=datawrapper&utm_campaign=covid-19&utm_source=categoryOverview"">Supporting businesses to get back to normal</a>"
35,Smoothing frictions or reallocation of workers,https://static.eurofound.europa.eu/covid19db/categories/Support_for_essential_services.html,Ensuring business continuity and support for essential services,19,"<a href=""https://static.eurofound.europa.eu/covid19db/categories/Support_for_essential_services.html?utm_medium=datawrapper&utm_campaign=covid-19&utm_source=categoryOverview"">Ensuring business continuity and support for essential services</a>"
28,Other,https://static.eurofound.europa.eu/covid19db/categories/Supporting_businesses_to_stay_afloat.html,Supporting businesses to stay afloat,18,"<a href=""https://static.eurofound.europa.eu/covid19db/categories/Supporting_businesses_to_stay_afloat.html?utm_medium=datawrapper&utm_campaign=covid-19&utm_source=categoryOverview"">Supporting businesses to stay afloat</a>"
13,Flexibilisation and security,https://static.eurofound.europa.eu/covid19db/categories/Promoting_the_economic_labour_market_and_social_recovery.html,"Promoting the economic, labour market and social recovery",15,"<a href=""https://static.eurofound.europa.eu/covid19db/categories/Promoting_the_economic_labour_market_and_social_recovery.html?utm_medium=datawrapper&utm_campaign=covid-19&utm_source=categoryOverview"">Promoting the economic, labour market and social recovery</a>"
7,Changes of working hours or work arrangements,https://static.eurofound.europa.eu/covid19db/categories/Protection_of_workers_adaption_of_workplace.html,"Protection of workers, adaptation of workplace",14,"<a href=""https://static.eurofound.europa.eu/covid19db/categories/Protection_of_workers_adaption_of_workplace.html?utm_medium=datawrapper&utm_campaign=covid-19&utm_source=categoryOverview"">Protection of workers, adaptation of workplace</a>"
42,Working time and working time flexibility,https://static.eurofound.europa.eu/covid19db/categories/Employment_protection_and_retention.html,Employment protection and retention,13,"<a href=""https://static.eurofound.europa.eu/covid19db/categories/Employment_protection_and_retention.html?utm_medium=datawrapper&utm_campaign=covid-19&utm_source=categoryOverview"">Employment protection and retention</a>"
30,Preventing over-indebtedness,https://static.eurofound.europa.eu/covid19db/categories/Measures_to_prevent_social_hardship.html,Measures to prevent social hardship,11,"<a href=""https://static.eurofound.europa.eu/covid19db/categories/Measures_to_prevent_social_hardship.html?utm_medium=datawrapper&utm_campaign=covid-19&utm_source=categoryOverview"">Measures to prevent social hardship</a>"
5,Changes in work organisation,https://static.eurofound.europa.eu/covid19db/categories/Protection_of_workers_adaption_of_workplace.html,"Protection of workers, adaptation of workplace",11,"<a href=""https://static.eurofound.europa.eu/covid19db/categories/Protection_of_workers_adaption_of_workplace.html?utm_medium=datawrapper&utm_campaign=covid-19&utm_source=categoryOverview"">Protection of workers, adaptation of workplace</a>"
40,Wage flexibility ,https://static.eurofound.europa.eu/covid19db/categories/Employment_protection_and_retention.html,Employment protection and retention,10,"<a href=""https://static.eurofound.europa.eu/covid19db/categories/Employment_protection_and_retention.html?utm_medium=datawrapper&utm_campaign=covid-19&utm_source=categoryOverview"">Employment protection and retention</a>"
32,Provision of services in kind (e.g. food vouchers),https://static.eurofound.europa.eu/covid19db/categories/Measures_to_prevent_social_hardship.html,Measures to prevent social hardship,8,"<a href=""https://static.eurofound.europa.eu/covid19db/categories/Measures_to_prevent_social_hardship.html?utm_medium=datawrapper&utm_campaign=covid-19&utm_source=categoryOverview"">Measures to prevent social hardship</a>"
24,Other,https://static.eurofound.europa.eu/covid19db/categories/Protection_of_workers_adaption_of_workplace.html,"Protection of workers, adaptation of workplace",7,"<a href=""https://static.eurofound.europa.eu/covid19db/categories/Protection_of_workers_adaption_of_workplace.html?utm_medium=datawrapper&utm_campaign=covid-19&utm_source=categoryOverview"">Protection of workers, adaptation of workplace</a>"
34,Rescue procedures in case of insolvency or adaptation of insolvency regulation,https://static.eurofound.europa.eu/covid19db/categories/Supporting_businesses_to_stay_afloat.html,Supporting businesses to stay afloat,6,"<a href=""https://static.eurofound.europa.eu/covid19db/categories/Supporting_businesses_to_stay_afloat.html?utm_medium=datawrapper&utm_campaign=covid-19&utm_source=categoryOverview"">Supporting businesses to stay afloat</a>"
1,Access to healthcare,https://static.eurofound.europa.eu/covid19db/categories/Measures_to_prevent_social_hardship.html,Measures to prevent social hardship,6,"<a href=""https://static.eurofound.europa.eu/covid19db/categories/Measures_to_prevent_social_hardship.html?utm_medium=datawrapper&utm_campaign=covid-19&utm_source=categoryOverview"">Measures to prevent social hardship</a>"
26,Other,https://static.eurofound.europa.eu/covid19db/categories/Support_for_essential_services.html,Ensuring business continuity and support for essential services,5,"<a href=""https://static.eurofound.europa.eu/covid19db/categories/Support_for_essential_services.html?utm_medium=datawrapper&utm_campaign=covid-19&utm_source=categoryOverview"">Ensuring business continuity and support for essential services</a>"
8,Creation of platforms for businesses aimed at customer,https://static.eurofound.europa.eu/covid19db/categories/Re-orientation_of_business_activities.html,Reorientation of business activities,5,"<a href=""https://static.eurofound.europa.eu/covid19db/categories/Re-orientation_of_business_activities.html?utm_medium=datawrapper&utm_campaign=covid-19&utm_source=categoryOverview"">Reorientation of business activities</a>"
39,Transfer or redeployment of workers ,https://static.eurofound.europa.eu/covid19db/categories/Re-orientation_of_business_activities.html,Reorientation of business activities,5,"<a href=""https://static.eurofound.europa.eu/covid19db/categories/Re-orientation_of_business_activities.html?utm_medium=datawrapper&utm_campaign=covid-19&utm_source=categoryOverview"">Reorientation of business activities</a>"
27,Other,https://static.eurofound.europa.eu/covid19db/categories/Supporting_businesses_to_get_back-to-normal.html,Supporting businesses to get back to normal,4,"<a href=""https://static.eurofound.europa.eu/covid19db/categories/Supporting_businesses_to_get_back-to-normal.html?utm_medium=datawrapper&utm_campaign=covid-19&utm_source=categoryOverview"">Supporting businesses to get back to normal</a>"
17,Matching/networking,https://static.eurofound.europa.eu/covid19db/categories/Re-orientation_of_business_activities.html,Reorientation of business activities,4,"<a href=""https://static.eurofound.europa.eu/covid19db/categories/Re-orientation_of_business_activities.html?utm_medium=datawrapper&utm_campaign=covid-19&utm_source=categoryOverview"">Reorientation of business activities</a>"
6,Changes of management approach,https://static.eurofound.europa.eu/covid19db/categories/Protection_of_workers_adaption_of_workplace.html,"Protection of workers, adaptation of workplace",3,"<a href=""https://static.eurofound.europa.eu/covid19db/categories/Protection_of_workers_adaption_of_workplace.html?utm_medium=datawrapper&utm_campaign=covid-19&utm_source=categoryOverview"">Protection of workers, adaptation of workplace</a>"
21,Other,https://static.eurofound.europa.eu/covid19db/categories/Employment_protection_and_retention.html,Employment protection and retention,2,"<a href=""https://static.eurofound.europa.eu/covid19db/categories/Employment_protection_and_retention.html?utm_medium=datawrapper&utm_campaign=covid-19&utm_source=categoryOverview"">Employment protection and retention</a>"
25,Other,https://static.eurofound.europa.eu/covid19db/categories/Re-orientation_of_business_activities.html,Reorientation of business activities,1,"<a href=""https://static.eurofound.europa.eu/covid19db/categories/Re-orientation_of_business_activities.html?utm_medium=datawrapper&utm_campaign=covid-19&utm_source=categoryOverview"">Reorientation of business activities</a>"
22,Other,https://static.eurofound.europa.eu/covid19db/categories/Measures_to_prevent_social_hardship.html,Measures to prevent social hardship,1,"<a href=""https://static.eurofound.europa.eu/covid19db/categories/Measures_to_prevent_social_hardship.html?utm_medium=datawrapper&utm_campaign=covid-19&utm_source=categoryOverview"">Measures to prevent social hardship</a>"
