,calc_subMinorCategory,calc_minorCategory,calc_category_githubURL,__KP_ID,Category
11,Direct subsidies (full or partial),Supporting businesses to stay afloat,https://static.eurofound.europa.eu/covid19db/categories/Supporting_businesses_to_stay_afloat.html,272,"<a href=""https://static.eurofound.europa.eu/covid19db/categories/Supporting_businesses_to_stay_afloat.html?utm_medium=datawrapper&utm_campaign=covid-19&utm_source=categoryOverview"">Supporting businesses to stay afloat</a>"
3,"Active labour market policies (enhancing employability, training, subsidised job creation, etc.)","Promoting the economic, labour market and social recovery",https://static.eurofound.europa.eu/covid19db/categories/Promoting_the_economic_labour_market_and_social_recovery.html,180,"<a href=""https://static.eurofound.europa.eu/covid19db/categories/Promoting_the_economic_labour_market_and_social_recovery.html?utm_medium=datawrapper&utm_campaign=covid-19&utm_source=categoryOverview"">Promoting the economic, labour market and social recovery</a>"
1,Access to finance,Supporting businesses to stay afloat,https://static.eurofound.europa.eu/covid19db/categories/Supporting_businesses_to_stay_afloat.html,152,"<a href=""https://static.eurofound.europa.eu/covid19db/categories/Supporting_businesses_to_stay_afloat.html?utm_medium=datawrapper&utm_campaign=covid-19&utm_source=categoryOverview"">Supporting businesses to stay afloat</a>"
15,"Income support for people in employment (e.g., short-time work)",Employment protection and retention,https://static.eurofound.europa.eu/covid19db/categories/Employment_protection_and_retention.html,152,"<a href=""https://static.eurofound.europa.eu/covid19db/categories/Employment_protection_and_retention.html?utm_medium=datawrapper&utm_campaign=covid-19&utm_source=categoryOverview"">Employment protection and retention</a>"
4,Change of production/innovation,Reorientation of business activities,https://static.eurofound.europa.eu/covid19db/categories/Re-orientation_of_business_activities.html,113,"<a href=""https://static.eurofound.europa.eu/covid19db/categories/Re-orientation_of_business_activities.html?utm_medium=datawrapper&utm_campaign=covid-19&utm_source=categoryOverview"">Reorientation of business activities</a>"
22,Occupational health and safety,"Protection of workers, adaptation of workplace",https://static.eurofound.europa.eu/covid19db/categories/Protection_of_workers_adaption_of_workplace.html,93,"<a href=""https://static.eurofound.europa.eu/covid19db/categories/Protection_of_workers_adaption_of_workplace.html?utm_medium=datawrapper&utm_campaign=covid-19&utm_source=categoryOverview"">Protection of workers, adaptation of workplace</a>"
10,Deferral of payments or liabilities,Supporting businesses to stay afloat,https://static.eurofound.europa.eu/covid19db/categories/Supporting_businesses_to_stay_afloat.html,78,"<a href=""https://static.eurofound.europa.eu/covid19db/categories/Supporting_businesses_to_stay_afloat.html?utm_medium=datawrapper&utm_campaign=covid-19&utm_source=categoryOverview"">Supporting businesses to stay afloat</a>"
44,"Support for spending, stimulus packages","Promoting the economic, labour market and social recovery",https://static.eurofound.europa.eu/covid19db/categories/Promoting_the_economic_labour_market_and_social_recovery.html,71,"<a href=""https://static.eurofound.europa.eu/covid19db/categories/Promoting_the_economic_labour_market_and_social_recovery.html?utm_medium=datawrapper&utm_campaign=covid-19&utm_source=categoryOverview"">Promoting the economic, labour market and social recovery</a>"
35,Protection of vulnerable groups (beyond employment support),Measures to prevent social hardship,https://static.eurofound.europa.eu/covid19db/categories/Measures_to_prevent_social_hardship.html,68,"<a href=""https://static.eurofound.europa.eu/covid19db/categories/Measures_to_prevent_social_hardship.html?utm_medium=datawrapper&utm_campaign=covid-19&utm_source=categoryOverview"">Measures to prevent social hardship</a>"
40,Support for energy bills,Responses to inflation,https://static.eurofound.europa.eu/covid19db/categories/Responses_to_inflation.html,68,"<a href=""https://static.eurofound.europa.eu/covid19db/categories/Responses_to_inflation.html?utm_medium=datawrapper&utm_campaign=covid-19&utm_source=categoryOverview"">Responses to inflation</a>"
12,Extensions of income support to workers not covered by any kind of protection scheme,Income protection beyond short-time work,https://static.eurofound.europa.eu/covid19db/categories/Income_protection_beyond_short-time_work.html,66,"<a href=""https://static.eurofound.europa.eu/covid19db/categories/Income_protection_beyond_short-time_work.html?utm_medium=datawrapper&utm_campaign=covid-19&utm_source=categoryOverview"">Income protection beyond short-time work</a>"
18,Keeping or obtaining a safe home,Measures to prevent social hardship,https://static.eurofound.europa.eu/covid19db/categories/Measures_to_prevent_social_hardship.html,63,"<a href=""https://static.eurofound.europa.eu/covid19db/categories/Measures_to_prevent_social_hardship.html?utm_medium=datawrapper&utm_campaign=covid-19&utm_source=categoryOverview"">Measures to prevent social hardship</a>"
39,Smoothing frictions or reallocation of workers,Ensuring business continuity and support for essential services,https://static.eurofound.europa.eu/covid19db/categories/Support_for_essential_services.html,62,"<a href=""https://static.eurofound.europa.eu/covid19db/categories/Support_for_essential_services.html?utm_medium=datawrapper&utm_campaign=covid-19&utm_source=categoryOverview"">Ensuring business continuity and support for essential services</a>"
45,"Teleworking arrangements, remote working","Protection of workers, adaptation of workplace",https://static.eurofound.europa.eu/covid19db/categories/Protection_of_workers_adaption_of_workplace.html,61,"<a href=""https://static.eurofound.europa.eu/covid19db/categories/Protection_of_workers_adaption_of_workplace.html?utm_medium=datawrapper&utm_campaign=covid-19&utm_source=categoryOverview"">Protection of workers, adaptation of workplace</a>"
17,Increasing income in general,Responses to inflation,https://static.eurofound.europa.eu/covid19db/categories/Responses_to_inflation.html,44,"<a href=""https://static.eurofound.europa.eu/covid19db/categories/Responses_to_inflation.html?utm_medium=datawrapper&utm_campaign=covid-19&utm_source=categoryOverview"">Responses to inflation</a>"
43,Support for parents and carers (financial or in kind),Income protection beyond short-time work,https://static.eurofound.europa.eu/covid19db/categories/Income_protection_beyond_short-time_work.html,41,"<a href=""https://static.eurofound.europa.eu/covid19db/categories/Income_protection_beyond_short-time_work.html?utm_medium=datawrapper&utm_campaign=covid-19&utm_source=categoryOverview"">Income protection beyond short-time work</a>"
37,Remuneration and rewards for workers in essential services,Ensuring business continuity and support for essential services,https://static.eurofound.europa.eu/covid19db/categories/Support_for_essential_services.html,39,"<a href=""https://static.eurofound.europa.eu/covid19db/categories/Support_for_essential_services.html?utm_medium=datawrapper&utm_campaign=covid-19&utm_source=categoryOverview"">Ensuring business continuity and support for essential services</a>"
5,"Change of work arrangements (working time, rota schemes)",Ensuring business continuity and support for essential services,https://static.eurofound.europa.eu/covid19db/categories/Support_for_essential_services.html,36,"<a href=""https://static.eurofound.europa.eu/covid19db/categories/Support_for_essential_services.html?utm_medium=datawrapper&utm_campaign=covid-19&utm_source=categoryOverview"">Ensuring business continuity and support for essential services</a>"
16,Income support for unemployed,Income protection beyond short-time work,https://static.eurofound.europa.eu/covid19db/categories/Income_protection_beyond_short-time_work.html,34,"<a href=""https://static.eurofound.europa.eu/covid19db/categories/Income_protection_beyond_short-time_work.html?utm_medium=datawrapper&utm_campaign=covid-19&utm_source=categoryOverview"">Income protection beyond short-time work</a>"
48,Well-being of workers,"Protection of workers, adaptation of workplace",https://static.eurofound.europa.eu/covid19db/categories/Protection_of_workers_adaption_of_workplace.html,31,"<a href=""https://static.eurofound.europa.eu/covid19db/categories/Protection_of_workers_adaption_of_workplace.html?utm_medium=datawrapper&utm_campaign=covid-19&utm_source=categoryOverview"">Protection of workers, adaptation of workplace</a>"
33,Paid sick leave,Income protection beyond short-time work,https://static.eurofound.europa.eu/covid19db/categories/Income_protection_beyond_short-time_work.html,30,"<a href=""https://static.eurofound.europa.eu/covid19db/categories/Income_protection_beyond_short-time_work.html?utm_medium=datawrapper&utm_campaign=covid-19&utm_source=categoryOverview"">Income protection beyond short-time work</a>"
19,Matching/networking,Reorientation of business activities,https://static.eurofound.europa.eu/covid19db/categories/Re-orientation_of_business_activities.html,29,"<a href=""https://static.eurofound.europa.eu/covid19db/categories/Re-orientation_of_business_activities.html?utm_medium=datawrapper&utm_campaign=covid-19&utm_source=categoryOverview"">Reorientation of business activities</a>"
31,Other,Supporting businesses to stay afloat,https://static.eurofound.europa.eu/covid19db/categories/Supporting_businesses_to_stay_afloat.html,28,"<a href=""https://static.eurofound.europa.eu/covid19db/categories/Supporting_businesses_to_stay_afloat.html?utm_medium=datawrapper&utm_campaign=covid-19&utm_source=categoryOverview"">Supporting businesses to stay afloat</a>"
27,Other,"Promoting the economic, labour market and social recovery",https://static.eurofound.europa.eu/covid19db/categories/Promoting_the_economic_labour_market_and_social_recovery.html,28,"<a href=""https://static.eurofound.europa.eu/covid19db/categories/Promoting_the_economic_labour_market_and_social_recovery.html?utm_medium=datawrapper&utm_campaign=covid-19&utm_source=categoryOverview"">Promoting the economic, labour market and social recovery</a>"
0,Access to childcare and education,Measures to prevent social hardship,https://static.eurofound.europa.eu/covid19db/categories/Measures_to_prevent_social_hardship.html,27,"<a href=""https://static.eurofound.europa.eu/covid19db/categories/Measures_to_prevent_social_hardship.html?utm_medium=datawrapper&utm_campaign=covid-19&utm_source=categoryOverview"">Measures to prevent social hardship</a>"
20,Measures to support a gradual relaunch of work,"Promoting the economic, labour market and social recovery",https://static.eurofound.europa.eu/covid19db/categories/Promoting_the_economic_labour_market_and_social_recovery.html,27,"<a href=""https://static.eurofound.europa.eu/covid19db/categories/Promoting_the_economic_labour_market_and_social_recovery.html?utm_medium=datawrapper&utm_campaign=covid-19&utm_source=categoryOverview"">Promoting the economic, labour market and social recovery</a>"
2,Access to healthcare,Measures to prevent social hardship,https://static.eurofound.europa.eu/covid19db/categories/Measures_to_prevent_social_hardship.html,26,"<a href=""https://static.eurofound.europa.eu/covid19db/categories/Measures_to_prevent_social_hardship.html?utm_medium=datawrapper&utm_campaign=covid-19&utm_source=categoryOverview"">Measures to prevent social hardship</a>"
32,Other humanitarian measures,Measures to prevent social hardship,https://static.eurofound.europa.eu/covid19db/categories/Measures_to_prevent_social_hardship.html,26,"<a href=""https://static.eurofound.europa.eu/covid19db/categories/Measures_to_prevent_social_hardship.html?utm_medium=datawrapper&utm_campaign=covid-19&utm_source=categoryOverview"">Measures to prevent social hardship</a>"
21,Mobilisation of a larger workforce,Ensuring business continuity and support for essential services,https://static.eurofound.europa.eu/covid19db/categories/Support_for_essential_services.html,24,"<a href=""https://static.eurofound.europa.eu/covid19db/categories/Support_for_essential_services.html?utm_medium=datawrapper&utm_campaign=covid-19&utm_source=categoryOverview"">Ensuring business continuity and support for essential services</a>"
49,Working time flexibility,Employment protection and retention,https://static.eurofound.europa.eu/covid19db/categories/Employment_protection_and_retention.html,23,"<a href=""https://static.eurofound.europa.eu/covid19db/categories/Employment_protection_and_retention.html?utm_medium=datawrapper&utm_campaign=covid-19&utm_source=categoryOverview"">Employment protection and retention</a>"
13,Flexibilisation and security,"Promoting the economic, labour market and social recovery",https://static.eurofound.europa.eu/covid19db/categories/Promoting_the_economic_labour_market_and_social_recovery.html,21,"<a href=""https://static.eurofound.europa.eu/covid19db/categories/Promoting_the_economic_labour_market_and_social_recovery.html?utm_medium=datawrapper&utm_campaign=covid-19&utm_source=categoryOverview"">Promoting the economic, labour market and social recovery</a>"
41,Support for fuel expenses,Responses to inflation,https://static.eurofound.europa.eu/covid19db/categories/Responses_to_inflation.html,19,"<a href=""https://static.eurofound.europa.eu/covid19db/categories/Responses_to_inflation.html?utm_medium=datawrapper&utm_campaign=covid-19&utm_source=categoryOverview"">Responses to inflation</a>"
46,Transfer or redeployment of workers ,Reorientation of business activities,https://static.eurofound.europa.eu/covid19db/categories/Re-orientation_of_business_activities.html,18,"<a href=""https://static.eurofound.europa.eu/covid19db/categories/Re-orientation_of_business_activities.html?utm_medium=datawrapper&utm_campaign=covid-19&utm_source=categoryOverview"">Reorientation of business activities</a>"
36,Provision of services in kind (e.g. food vouchers),Measures to prevent social hardship,https://static.eurofound.europa.eu/covid19db/categories/Measures_to_prevent_social_hardship.html,15,"<a href=""https://static.eurofound.europa.eu/covid19db/categories/Measures_to_prevent_social_hardship.html?utm_medium=datawrapper&utm_campaign=covid-19&utm_source=categoryOverview"">Measures to prevent social hardship</a>"
8,Changes of working hours or work arrangements,"Protection of workers, adaptation of workplace",https://static.eurofound.europa.eu/covid19db/categories/Protection_of_workers_adaption_of_workplace.html,15,"<a href=""https://static.eurofound.europa.eu/covid19db/categories/Protection_of_workers_adaption_of_workplace.html?utm_medium=datawrapper&utm_campaign=covid-19&utm_source=categoryOverview"">Protection of workers, adaptation of workplace</a>"
34,Preventing over-indebtedness,Measures to prevent social hardship,https://static.eurofound.europa.eu/covid19db/categories/Measures_to_prevent_social_hardship.html,13,"<a href=""https://static.eurofound.europa.eu/covid19db/categories/Measures_to_prevent_social_hardship.html?utm_medium=datawrapper&utm_campaign=covid-19&utm_source=categoryOverview"">Measures to prevent social hardship</a>"
6,Changes in work organisation,"Protection of workers, adaptation of workplace",https://static.eurofound.europa.eu/covid19db/categories/Protection_of_workers_adaption_of_workplace.html,12,"<a href=""https://static.eurofound.europa.eu/covid19db/categories/Protection_of_workers_adaption_of_workplace.html?utm_medium=datawrapper&utm_campaign=covid-19&utm_source=categoryOverview"">Protection of workers, adaptation of workplace</a>"
47,Wage flexibility ,Employment protection and retention,https://static.eurofound.europa.eu/covid19db/categories/Employment_protection_and_retention.html,12,"<a href=""https://static.eurofound.europa.eu/covid19db/categories/Employment_protection_and_retention.html?utm_medium=datawrapper&utm_campaign=covid-19&utm_source=categoryOverview"">Employment protection and retention</a>"
42,"Support for other basic items (e.g., food, housing, public transport, medicines)",Responses to inflation,https://static.eurofound.europa.eu/covid19db/categories/Responses_to_inflation.html,11,"<a href=""https://static.eurofound.europa.eu/covid19db/categories/Responses_to_inflation.html?utm_medium=datawrapper&utm_campaign=covid-19&utm_source=categoryOverview"">Responses to inflation</a>"
38,Rescue procedures in case of insolvency or adaptation of insolvency regulation,Supporting businesses to stay afloat,https://static.eurofound.europa.eu/covid19db/categories/Supporting_businesses_to_stay_afloat.html,11,"<a href=""https://static.eurofound.europa.eu/covid19db/categories/Supporting_businesses_to_stay_afloat.html?utm_medium=datawrapper&utm_campaign=covid-19&utm_source=categoryOverview"">Supporting businesses to stay afloat</a>"
28,Other,"Protection of workers, adaptation of workplace",https://static.eurofound.europa.eu/covid19db/categories/Protection_of_workers_adaption_of_workplace.html,9,"<a href=""https://static.eurofound.europa.eu/covid19db/categories/Protection_of_workers_adaption_of_workplace.html?utm_medium=datawrapper&utm_campaign=covid-19&utm_source=categoryOverview"">Protection of workers, adaptation of workplace</a>"
14,Foreign trade related measures,Supporting businesses to stay afloat,https://static.eurofound.europa.eu/covid19db/categories/Supporting_businesses_to_stay_afloat.html,9,"<a href=""https://static.eurofound.europa.eu/covid19db/categories/Supporting_businesses_to_stay_afloat.html?utm_medium=datawrapper&utm_campaign=covid-19&utm_source=categoryOverview"">Supporting businesses to stay afloat</a>"
30,Other,Responses to inflation,https://static.eurofound.europa.eu/covid19db/categories/Responses_to_inflation.html,8,"<a href=""https://static.eurofound.europa.eu/covid19db/categories/Responses_to_inflation.html?utm_medium=datawrapper&utm_campaign=covid-19&utm_source=categoryOverview"">Responses to inflation</a>"
23,Other,Employment protection and retention,https://static.eurofound.europa.eu/covid19db/categories/Employment_protection_and_retention.html,8,"<a href=""https://static.eurofound.europa.eu/covid19db/categories/Employment_protection_and_retention.html?utm_medium=datawrapper&utm_campaign=covid-19&utm_source=categoryOverview"">Employment protection and retention</a>"
9,Creation of platforms for businesses aimed at customer,Reorientation of business activities,https://static.eurofound.europa.eu/covid19db/categories/Re-orientation_of_business_activities.html,7,"<a href=""https://static.eurofound.europa.eu/covid19db/categories/Re-orientation_of_business_activities.html?utm_medium=datawrapper&utm_campaign=covid-19&utm_source=categoryOverview"">Reorientation of business activities</a>"
24,Other,Ensuring business continuity and support for essential services,https://static.eurofound.europa.eu/covid19db/categories/Support_for_essential_services.html,6,"<a href=""https://static.eurofound.europa.eu/covid19db/categories/Support_for_essential_services.html?utm_medium=datawrapper&utm_campaign=covid-19&utm_source=categoryOverview"">Ensuring business continuity and support for essential services</a>"
7,Changes of management approach,"Protection of workers, adaptation of workplace",https://static.eurofound.europa.eu/covid19db/categories/Protection_of_workers_adaption_of_workplace.html,4,"<a href=""https://static.eurofound.europa.eu/covid19db/categories/Protection_of_workers_adaption_of_workplace.html?utm_medium=datawrapper&utm_campaign=covid-19&utm_source=categoryOverview"">Protection of workers, adaptation of workplace</a>"
26,Other,Measures to prevent social hardship,https://static.eurofound.europa.eu/covid19db/categories/Measures_to_prevent_social_hardship.html,4,"<a href=""https://static.eurofound.europa.eu/covid19db/categories/Measures_to_prevent_social_hardship.html?utm_medium=datawrapper&utm_campaign=covid-19&utm_source=categoryOverview"">Measures to prevent social hardship</a>"
29,Other,Reorientation of business activities,https://static.eurofound.europa.eu/covid19db/categories/Re-orientation_of_business_activities.html,3,"<a href=""https://static.eurofound.europa.eu/covid19db/categories/Re-orientation_of_business_activities.html?utm_medium=datawrapper&utm_campaign=covid-19&utm_source=categoryOverview"">Reorientation of business activities</a>"
25,Other,Income protection beyond short-time work,https://static.eurofound.europa.eu/covid19db/categories/Income_protection_beyond_short-time_work.html,2,"<a href=""https://static.eurofound.europa.eu/covid19db/categories/Income_protection_beyond_short-time_work.html?utm_medium=datawrapper&utm_campaign=covid-19&utm_source=categoryOverview"">Income protection beyond short-time work</a>"
